{
  "contract_version": "1.0.0",
  "data_mode": "demo",
  "currency": "USD",
  "provider_status": {
    "connected": false,
    "adapter": "curated_demo_flights",
    "readiness": "contract_ready",
    "bookable": false
  },
  "airports": {
    "TLV": { "name": "Ben Gurion Airport", "city": "תל אביב", "country": "ישראל", "latitude": 32.0005, "longitude": 34.8708 },
    "BKK": { "name": "Suvarnabhumi Airport", "city": "בנגקוק", "country": "תאילנד", "latitude": 13.69, "longitude": 100.7501 },
    "DXB": { "name": "Dubai International", "city": "דובאי", "country": "איחוד האמירויות", "latitude": 25.2532, "longitude": 55.3657 },
    "ATH": { "name": "Athens International", "city": "אתונה", "country": "יוון", "latitude": 37.9364, "longitude": 23.9445 }
  },
  "offers": [
    {
      "id": "demo-direct-elal",
      "label": "ישיר עם EL AL",
      "badge": "הכי נוח",
      "score": 86,
      "airline": { "code": "LY", "name": "EL AL" },
      "outbound": { "duration_minutes": 680, "stops": 0, "via": [], "departure_time": "22:30", "arrival_time": "14:50" },
      "inbound": { "duration_minutes": 735, "stops": 0, "via": [], "departure_time": "16:20", "arrival_time": "22:35" },
      "ticket_mode": "single",
      "risk": "low",
      "emissions_kg": 1840,
      "fare": { "base": 710, "taxes": 189, "baggage": 90, "seats": 30, "service_fee": 0, "total": 1019 },
      "trip_total": { "flight": 1019, "hotel": 390, "transfers": 55, "insurance": 72, "overnight": 0, "total": 1536 },
      "policies": { "baggage": "מזוודה 23 ק״ג וטרולי", "changes": "שינוי בתשלום והפרש מחיר", "refundability": "החזר חלקי לפי תנאי הכרטיס" },
      "pros": ["ללא החלפת מטוס", "הזמן הקצר ביותר", "כרטיס אחד ותפעול פשוט"],
      "cons": ["העלות הכוללת הגבוהה ביותר", "פחות אפשרויות לשעות יציאה"],
      "booking": { "bookable": false, "provider": "demo", "checkout_url": null }
    },
    {
      "id": "demo-dubai-balanced",
      "label": "דרך דובאי",
      "badge": "הבחירה החכמה",
      "score": 94,
      "airline": { "code": "EK", "name": "Emirates" },
      "outbound": { "duration_minutes": 840, "stops": 1, "via": ["DXB"], "departure_time": "09:10", "arrival_time": "03:10" },
      "inbound": { "duration_minutes": 860, "stops": 1, "via": ["DXB"], "departure_time": "02:25", "arrival_time": "13:45" },
      "ticket_mode": "single",
      "risk": "low",
      "emissions_kg": 1690,
      "fare": { "base": 560, "taxes": 182, "baggage": 88, "seats": 30, "service_fee": 0, "total": 860 },
      "trip_total": { "flight": 860, "hotel": 390, "transfers": 55, "insurance": 72, "overnight": 0, "total": 1377 },
      "policies": { "baggage": "מזוודה 25 ק״ג וטרולי", "changes": "שינוי בתשלום מופחת", "refundability": "החזר חלקי לפי תנאי הכרטיס" },
      "pros": ["חיסכון של $159 מול הישיר", "כרטיס אחד לכל הדרך", "עצירה נוחה ללא לינת ביניים"],
      "cons": ["כשעתיים וארבעים דקות יותר לכל כיוון", "החלפת מטוס אחת"],
      "booking": { "bookable": false, "provider": "demo", "checkout_url": null }
    },
    {
      "id": "demo-athens-cheapest",
      "label": "עצירת לילה באתונה",
      "badge": "הכי זול",
      "score": 72,
      "airline": { "code": "MIX", "name": "שילוב חברות" },
      "outbound": { "duration_minutes": 1470, "stops": 1, "via": ["ATH"], "departure_time": "13:40", "arrival_time": "19:10" },
      "inbound": { "duration_minutes": 1080, "stops": 1, "via": ["ATH"], "departure_time": "08:30", "arrival_time": "22:30" },
      "ticket_mode": "separate",
      "risk": "medium",
      "emissions_kg": 1775,
      "fare": { "base": 460, "taxes": 161, "baggage": 110, "seats": 0, "service_fee": 0, "total": 731 },
      "trip_total": { "flight": 731, "hotel": 390, "transfers": 55, "insurance": 72, "overnight": 75, "total": 1323 },
      "policies": { "baggage": "תנאים שונים בכל כרטיס", "changes": "כל כרטיס משתנה בנפרד", "refundability": "מוגבל ותלוי חברת תעופה" },
      "pros": ["העלות המלאה הנמוכה ביותר", "אפשר להפוך את העצירה לערב באתונה"],
      "cons": ["כרטיסים נפרדים וסיכון בהחמצת המשך", "לינת ביניים וזמן דרך ארוך"],
      "booking": { "bookable": false, "provider": "demo", "checkout_url": null }
    }
  ]
}
